{"schema_version":1,"product":"wokcore","api_major":1,"version":"1.2.3","signing_key_id":"E8A6D79D6B0D7E47","artifacts":[{"target":"x86_64-pc-windows-msvc","file":"wokcore-v1.2.3-x86_64-pc-windows-msvc.zip","executable":"wokcore.exe","size":46,"sha256":"47406a44a59871b1f2763693de2e00de60908fed1296c6260eb1ea8c4093047e","url":"https://github.com/hongjiadev/wokcore/releases/download/v1.2.3/wokcore-v1.2.3-x86_64-pc-windows-msvc.zip"},{"target":"x86_64-apple-darwin","file":"wokcore-v1.2.3-x86_64-apple-darwin.tar.gz","executable":"wokcore","size":46,"sha256":"01dd289292f272c3c07e42ac16c02007b1328f00299ae0a34ae63e3aa91ef036","url":"https://github.com/hongjiadev/wokcore/releases/download/v1.2.3/wokcore-v1.2.3-x86_64-apple-darwin.tar.gz"},{"target":"aarch64-apple-darwin","file":"wokcore-v1.2.3-aarch64-apple-darwin.tar.gz","executable":"wokcore","size":47,"sha256":"36f813a1a545e7a282a57eeb74eb1eae3e148e07a6ca1d612a0948d7bb8cb5e7","url":"https://github.com/hongjiadev/wokcore/releases/download/v1.2.3/wokcore-v1.2.3-aarch64-apple-darwin.tar.gz"},{"target":"x86_64-unknown-linux-gnu","file":"wokcore-v1.2.3-x86_64-unknown-linux-gnu.tar.gz","executable":"wokcore","size":51,"sha256":"e3424b0708642e463598f7b825e7151139f723704096684dd6426012fd785e02","url":"https://github.com/hongjiadev/wokcore/releases/download/v1.2.3/wokcore-v1.2.3-x86_64-unknown-linux-gnu.tar.gz"},{"target":"aarch64-unknown-linux-gnu","file":"wokcore-v1.2.3-aarch64-unknown-linux-gnu.tar.gz","executable":"wokcore","size":52,"sha256":"7b22c5943f5a89df1863272f450489fddab9068f45501da99a34d00b38cf2fb7","url":"https://github.com/hongjiadev/wokcore/releases/download/v1.2.3/wokcore-v1.2.3-aarch64-unknown-linux-gnu.tar.gz"}]}
