{"schema_version":1,"product":"wokcore","api_major":1,"version":"1.2.3","signing_key_id":"514C7389C5626D59","artifacts":[{"target":"x86_64-pc-windows-msvc","file":"wokcore-v1.2.3-x86_64-pc-windows-msvc.zip","executable":"wokcore.exe","size":123,"sha256":"0000000000000000000000000000000000000000000000000000000000000000","url":"https://github.com/hongjiadev/wokcore/releases/download/v1.2.3/wokcore-v1.2.3-x86_64-pc-windows-msvc.zip"},{"target":"x86_64-apple-darwin","file":"wokcore-v1.2.3-x86_64-apple-darwin.tar.gz","executable":"wokcore","size":124,"sha256":"1111111111111111111111111111111111111111111111111111111111111111","url":"https://github.com/hongjiadev/wokcore/releases/download/v1.2.3/wokcore-v1.2.3-x86_64-apple-darwin.tar.gz"},{"target":"aarch64-apple-darwin","file":"wokcore-v1.2.3-aarch64-apple-darwin.tar.gz","executable":"wokcore","size":125,"sha256":"2222222222222222222222222222222222222222222222222222222222222222","url":"https://github.com/hongjiadev/wokcore/releases/download/v1.2.3/wokcore-v1.2.3-aarch64-apple-darwin.tar.gz"},{"target":"x86_64-unknown-linux-gnu","file":"wokcore-v1.2.3-x86_64-unknown-linux-gnu.tar.gz","executable":"wokcore","size":126,"sha256":"3333333333333333333333333333333333333333333333333333333333333333","url":"https://github.com/hongjiadev/wokcore/releases/download/v1.2.3/wokcore-v1.2.3-x86_64-unknown-linux-gnu.tar.gz"},{"target":"aarch64-unknown-linux-gnu","file":"wokcore-v1.2.3-aarch64-unknown-linux-gnu.tar.gz","executable":"wokcore","size":127,"sha256":"4444444444444444444444444444444444444444444444444444444444444444","url":"https://github.com/hongjiadev/wokcore/releases/download/v1.2.3/wokcore-v1.2.3-aarch64-unknown-linux-gnu.tar.gz"}]}
